{
  "coverage": {
    "ambiguous_ball_us": 100000,
    "ball_observed_us": 800000,
    "calibration_valid_us": 900000,
    "contested_us": 50000,
    "human_observed_us": 1000000,
    "joint_coverage_ratio": 0.5,
    "joint_observed_us": 500000,
    "low_joint_coverage_is_not_evaluable": true,
    "missing_ball_is_not_no_possession": true,
    "not_observed_us": 200000,
    "playable_us": 950000,
    "target_confirmed_us": 700000
  },
  "created_at_utc": "2026-07-24T11:25:42.130189Z",
  "interaction_policy_fingerprint": "2e8eeeed5e3869bce59f285d90896d9ea67380ae4cf75ec75591b93cb935e620",
  "not_evaluable_reasons": [],
  "quality_flags": [],
  "run_id": "run_20260724T112541933382Z_dfb16ad55764",
  "schema_version": 1,
  "video_id": "video_synth_01"
}
